Title,Category,Rating (1-5),Price (£),Availability
Hold Your Breath (Search and Rescue #1),Romance,1,28.82,In stock (14 available)
Hamilton: The Revolution,Nonfiction,3,58.79,In stock (14 available)
Greek Mythic History,Default,5,10.23,In stock (14 available)
God: The Most Unpleasant Character in All Fiction,Religion,5,30.03,In stock (14 available)
Glory over Everything: Beyond The Kitchen House,Historical Fiction,3,45.84,In stock (14 available)
Feathers: Displays of Brilliant Plumage,Art,3,49.05,In stock (14 available)
"Far & Away: Places on the Brink of Change: Seven Continents, Twenty-Five Years",Nonfiction,4,15.06,In stock (14 available)
Every Last Word,Default,3,46.47,In stock (14 available)
Eligible (The Austen Project #4),Fiction,3,27.09,In stock (14 available)
El Deafo,Sequential Art,5,57.62,In stock (14 available)
Eight Hundred Grapes,Fiction,4,14.39,In stock (14 available)
"Eaternity: More than 150 Deliciously Easy Vegan Recipes for a Long, Healthy, Satisfied, Joyful Life",Nonfiction,5,51.75,In stock (14 available)
"Eat Fat, Get Thin",Health,2,54.07,In stock (14 available)
Don't Get Caught,Young Adult,1,55.35,In stock (14 available)
Doctor Sleep (The Shining #2),Horror,2,40.12,In stock (14 available)
Demigods & Magicians: Percy and Annabeth Meet the Kanes (Percy Jackson & Kane Chronicles Crossover #1-3),Fantasy,5,37.51,In stock (14 available)
Dear Mr. Knightley,Fiction,5,11.21,In stock (14 available)
Daily Fantasy Sports,Default,1,36.58,In stock (14 available)
Crazy Love: Overwhelmed by a Relentless God,Christian,2,47.72,In stock (14 available)
Cometh the Hour (The Clifton Chronicles #6),Fiction,3,25.01,In stock (14 available)
Code Name Verity (Code Name Verity #1),Add a comment,4,22.13,In stock (14 available)
Clockwork Angel (The Infernal Devices #1),Default,1,44.14,In stock (14 available)
City of Glass (The Mortal Instruments #3),Fantasy,4,56.02,In stock (14 available)
City of Fallen Angels (The Mortal Instruments #4),Default,4,11.23,In stock (14 available)
City of Bones (The Mortal Instruments #1),Default,1,43.28,In stock (14 available)
City of Ashes (The Mortal Instruments #2),Default,1,47.27,In stock (14 available)
Cell,Add a comment,4,20.29,In stock (14 available)
Catching Jordan (Hundred Oaks),Young Adult,3,50.83,In stock (14 available)
"Carry On, Warrior: Thoughts on Life Unarmed",Default,3,31.85,In stock (14 available)
Carrie,Default,2,46.23,In stock (14 available)
Buying In: The Secret Dialogue Between What We Buy and Who We Are,Nonfiction,4,37.8,In stock (14 available)
Brain on Fire: My Month of Madness,Nonfiction,5,49.32,In stock (14 available)
Batman: Europa,Sequential Art,2,32.01,In stock (14 available)
Barefoot Contessa Back to Basics,Food and Drink,1,28.01,In stock (14 available)
Barefoot Contessa at Home: Everyday Recipes You'll Make Over and Over Again,Food and Drink,5,50.62,In stock (14 available)
Balloon Animals,Fiction,3,17.03,In stock (14 available)
Art Ops Vol. 1,Sequential Art,3,48.8,In stock (14 available)
Aristotle and Dante Discover the Secrets of the Universe (Aristotle and Dante Discover the Secrets of the Universe #1),Young Adult,4,58.14,In stock (14 available)
Angels Walking (Angels Walking #1),Add a comment,2,34.2,In stock (14 available)
Angels & Demons (Robert Langdon #1),Default,3,51.48,In stock (14 available)
All the Light We Cannot See,Historical,5,29.87,In stock (14 available)
"Adulthood Is a Myth: A ""Sarah's Scribbles"" Collection",Sequential Art,2,10.9,In stock (14 available)
Abstract City,Nonfiction,5,56.37,In stock (14 available)
A Time of Torment (Charlie Parker #14),Mystery,5,48.35,In stock (14 available)
A Study in Scarlet (Sherlock Holmes #1),Mystery,2,16.73,In stock (14 available)
"A Series of Catastrophes and Miracles: A True Story of Love, Science, and Cancer",Add a comment,2,56.48,In stock (14 available)
A People's History of the United States,Add a comment,2,40.79,In stock (14 available)
A Man Called Ove,Fiction,1,39.72,In stock (14 available)
A Distant Mirror: The Calamitous 14th Century,History,3,14.58,In stock (14 available)
A Brush of Wings (Angels Walking #3),Add a comment,1,55.51,In stock (14 available)
1491: New Revelations of the Americas Before Columbus,History,3,21.8,In stock (14 available)
"The Three Searches, Meaning, and the Story",Default,3,13.33,In stock (13 available)
Searching for Meaning in Gailana,Fantasy,1,38.73,In stock (13 available)
Rook,Add a comment,4,37.86,In stock (13 available)
My Kitchen Year: 136 Recipes That Saved My Life,Food and Drink,2,11.53,In stock (13 available)
13 Hours: The Inside Account of What Really Happened In Benghazi,Nonfiction,1,27.06,In stock (13 available)
Will You Won't You Want Me?,Womens Fiction,3,13.86,In stock (12 available)
Tipping Point for Planet Earth: How Close Are We to the Edge?,Science,1,37.55,In stock (12 available)
The Star-Touched Queen,Fantasy,5,32.3,In stock (12 available)
The Silent Sister (Riley MacPherson #1),Fiction,5,46.29,In stock (12 available)
The Midnight Watch: A Novel of the Titanic and the Californian,Add a comment,1,26.2,In stock (12 available)
The Lonely City: Adventures in the Art of Being Alone,Nonfiction,2,33.26,In stock (12 available)
The Gray Rhino: How to Recognize and Act on the Obvious Dangers We Ignore,Add a comment,4,59.15,In stock (12 available)
The Golden Condom: And Other Essays on Love Lost and Found,Psychology,1,39.43,In stock (12 available)
The Epidemic (The Program 0.6),Young Adult,5,14.44,In stock (12 available)
The Dinner Party,Fiction,2,56.54,In stock (12 available)
The Diary of a Young Girl,Nonfiction,3,59.9,In stock (12 available)
The Children,Add a comment,3,11.88,In stock (12 available)
Stars Above (The Lunar Chronicles #4.5),Young Adult,2,48.05,In stock (12 available)
Snatched: How A Drug Queen Went Undercover for the DEA and Was Kidnapped By Colombian Guerillas,Nonfiction,3,21.21,In stock (12 available)
Raspberry Pi Electronics Projects for the Evil Genius,Default,4,49.67,In stock (12 available)
Quench Your Own Thirst: Business Lessons Learned Over a Beer or Two,Business,1,43.14,In stock (12 available)
Psycho: Sanitarium (Psycho #1.5),Horror,5,36.97,In stock (12 available)
Poisonous (Max Revere Novels #3),Mystery,3,26.8,In stock (12 available)
One with You (Crossfire #5),Add a comment,4,15.71,In stock (12 available)
No Love Allowed (Dodge Cove #1),Young Adult,4,54.65,In stock (12 available)
Murder at the 42nd Street Library (Raymond Ambler #1),Mystery,4,54.36,In stock (12 available)
Most Wanted,Mystery,3,35.28,In stock (12 available)
"Love, Lies and Spies",Historical Fiction,2,20.55,In stock (12 available)
How to Speak Golf: An Illustrated Guide to Links Lingo,Default,5,58.32,In stock (12 available)
Hide Away (Eve Duncan #20),Mystery,1,11.84,In stock (12 available)
Furiously Happy: A Funny Book About Horrible Things,Nonfiction,4,41.46,In stock (12 available)
Everyday Italian: 125 Simple and Delicious Recipes,Food and Drink,5,20.1,In stock (12 available)
Equal Is Unfair: America's Misguided Fight Against Income Inequality,Politics,1,56.86,In stock (12 available)
Eleanor & Park,Default,5,56.51,In stock (12 available)
Dirty (Dive Bar #1),Romance,4,40.83,In stock (12 available)
Can You Keep a Secret? (Fear Street Relaunch #4),Horror,1,48.64,In stock (12 available)
Boar Island (Anna Pigeon #19),Mystery,3,59.48,In stock (12 available)
A Paris Apartment,Historical Fiction,4,39.01,In stock (12 available)
"A la Mode: 120 Recipes in 60 Pairings: Pies, Tarts, Cakes, Crisps, and More Topped with Ice Cream, Gelato, Frozen Custard, and More",Food and Drink,1,38.77,In stock (12 available)
Troublemaker: Surviving Hollywood and Scientology,Default,2,48.39,In stock (11 available)
The Widow,Mystery,2,27.26,In stock (11 available)
"The Sleep Revolution: Transforming Your Life, One Night at a Time",Nonfiction,4,11.68,In stock (11 available)
The Improbability of Love,Fiction,1,59.45,In stock (11 available)
The Art of Startup Fundraising,Business,3,21.0,In stock (11 available)
Take Me Home Tonight (Rock Star Romance #3),Romance,3,53.98,In stock (11 available)
Sleeping Giants (Themis Files #1),Science Fiction,1,48.74,In stock (11 available)
"Setting the World on Fire: The Brief, Astonishing Life of St. Catherine of Siena",Biography,2,21.15,In stock (11 available)
Playing with Fire,Mystery,3,13.71,In stock (11 available)
Off the Hook (Fishing for Trouble #1),Romance,3,47.67,In stock (11 available)
Mothering Sunday,Fiction,2,13.34,In stock (11 available)
"Mother, Can You Not?",Nonfiction,5,16.89,In stock (11 available)
M Train,Autobiography,1,27.18,In stock (11 available)
Lilac Girls,Historical Fiction,2,17.28,In stock (11 available)
Lies and Other Acts of Love,Fiction,1,45.14,In stock (11 available)
Lab Girl,Autobiography,1,40.85,In stock (11 available)
Keep Me Posted,Womens Fiction,4,20.46,In stock (11 available)
It Didn't Start with You: How Inherited Family Trauma Shapes Who We Are and How to End the Cycle,Psychology,3,56.27,In stock (11 available)
Grey (Fifty Shades #4),Womens Fiction,4,48.49,In stock (11 available)
"Exit, Pursued by a Bear",Young Adult,4,51.34,In stock (11 available)
Daredevils,Fiction,3,16.34,In stock (11 available)
Cravings: Recipes for What You Want to Eat,Food and Drink,3,20.5,In stock (11 available)
Born for This: How to Find the Work You Were Meant to Do,Business,5,21.59,In stock (11 available)
Arena,Science Fiction,4,21.36,In stock (11 available)
Adultery,Default,5,20.88,In stock (11 available)
A Mother's Reckoning: Living in the Aftermath of Tragedy,Nonfiction,3,19.53,In stock (11 available)
A Gentleman's Position (Society of Gentlemen #3),Romance,5,14.75,In stock (11 available)
11/22/63,Fiction,3,48.48,In stock (11 available)
"10% Happier: How I Tamed the Voice in My Head, Reduced Stress Without Losing My Edge, and Found Self-Help That Actually Works",Nonfiction,2,24.57,In stock (10 available)
10-Day Green Smoothie Cleanse: Lose Up to 15 Pounds in 10 Days!,Health,5,49.71,In stock (10 available)
Without Shame,Add a comment,5,48.27,In stock (9 available)
Watchmen,Add a comment,4,58.05,In stock (9 available)
Unlimited Intuition Now,Default,4,58.87,In stock (9 available)
Underlying Notes,Default,2,11.82,In stock (9 available)
The Shack,Fiction,1,28.03,In stock (9 available)
The New Brand You: Your New Image Makes the Sale for You,Default,5,44.05,In stock (9 available)
"The Moosewood Cookbook: Recipes from Moosewood Restaurant, Ithaca, New York",Food and Drink,4,12.34,In stock (9 available)
The Flowers Lied,Default,2,16.68,In stock (9 available)
"The Fabric of the Cosmos: Space, Time, and the Texture of Reality",Science,1,55.91,In stock (9 available)
The Book of Mormon,Religion,3,24.57,In stock (9 available)
The Art and Science of Low Carbohydrate Living,Health,5,52.98,In stock (9 available)
The Alien Club,Young Adult,1,54.4,In stock (9 available)
Suzie Snowflake: One beautiful flake (a self-esteem story),Novels,5,54.81,In stock (9 available)
Nap-a-Roo,Childrens,1,25.08,In stock (9 available)
"NaNo What Now? Finding your editing process, revising your NaNoWriMo book and building a writing career through publishing and beyond",Default,4,10.41,In stock (9 available)
Modern Day Fables,Default,2,47.44,In stock (9 available)
If I Gave You God's Phone Number....: Searching for Spirituality in America,Spirituality,1,20.91,In stock (9 available)
"Fruits Basket, Vol. 9 (Fruits Basket #9)",Sequential Art,4,33.95,In stock (9 available)
Dress Your Family in Corduroy and Denim,Humor,3,43.68,In stock (9 available)
Don't Forget Steven,Young Adult,1,33.23,In stock (9 available)
Chernobyl 01:23:40: The Incredible True Story of the World's Worst Nuclear Disaster,Nonfiction,2,35.92,In stock (9 available)
Art and Fear: Observations on the Perils (and Rewards) of Artmaking,Art,4,48.63,In stock (9 available)
A Shard of Ice (The Black Symphony Saga #1),Fantasy,3,56.63,In stock (9 available)
A Hero's Curse (The Unseen Chronicles #1),Add a comment,3,50.49,In stock (9 available)
23 Degrees South: A Tropical Tale of Changing Whether...,Add a comment,2,35.79,In stock (9 available)
"Zero to One: Notes on Startups, or How to Build the Future",Nonfiction,3,34.06,In stock (8 available)
Why Not Me?,Nonfiction,1,17.76,In stock (8 available)
When Breath Becomes Air,Nonfiction,2,39.36,In stock (8 available)
Vagabonding: An Uncommon Guide to the Art of Long-Term World Travel,Travel,2,36.94,In stock (8 available)
The Unlikely Pilgrimage of Harold Fry (Harold Fry #1),Default,5,43.62,In stock (8 available)
The New Drawing on the Right Side of the Brain,Art,3,43.02,In stock (8 available)
"The Midnight Assassin: Panic, Scandal, and the Hunt for America's First Serial Killer",Nonfiction,4,28.45,In stock (8 available)
The Martian (The Martian #1),Default,2,41.39,In stock (8 available)
The High Mountains of Portugal,Fiction,1,51.15,In stock (8 available)
The Grownup,Short Stories,1,35.88,In stock (8 available)
The E-Myth Revisited: Why Most Small Businesses Don't Work and What to Do About It,Business,1,36.91,In stock (8 available)
South of Sunshine,Young Adult,1,28.93,In stock (8 available)
Smarter Faster Better: The Secrets of Being Productive in Life and Business,Nonfiction,5,38.89,In stock (8 available)
Silence in the Dark (Logan Point #4),Suspense,3,58.33,In stock (8 available)
Shadows of the Past (Logan Point #1),Christian Fiction,5,39.67,In stock (8 available)
Roller Girl,Sequential Art,5,14.1,In stock (8 available)
Rising Strong,Nonfiction,3,21.82,In stock (8 available)
Proofs of God: Classical Arguments from Tertullian to Barth,Philosophy,1,54.21,In stock (8 available)
Please Kill Me: The Uncensored Oral History of Punk,Music,4,31.19,In stock (8 available)
Out of Print: City Lights Spotlight No. 14,Poetry,5,53.64,In stock (8 available)
My Life Next Door (My Life Next Door ),Young Adult,5,36.39,In stock (8 available)
Miller's Valley,Fiction,2,58.54,In stock (8 available)
Man's Search for Meaning,Nonfiction,3,29.48,In stock (8 available)
"Love That Boy: What Two Presidents, Eight Road Trips, and My Son Taught Me About a Parent's Expectations",Nonfiction,2,25.06,In stock (8 available)
Living Forward: A Proven Plan to Stop Drifting and Get the Life You Want,Nonfiction,3,12.55,In stock (8 available)
Les Fleurs du Mal,Poetry,5,29.04,In stock (8 available)
Left Behind (Left Behind #1),Default,2,40.72,In stock (8 available)
Kill 'Em and Leave: Searching for James Brown and the American Soul,Music,5,45.05,In stock (8 available)
Kierkegaard: A Christian Missionary to Christians,Philosophy,1,47.13,In stock (8 available)
John Vassos: Industrial Design for Modern Life,Default,4,20.22,In stock (8 available)
I'll Give You the Sun,Default,1,56.48,In stock (8 available)
I Will Find You,Nonfiction,1,44.21,In stock (8 available)
Hystopia: A Novel,Fiction,4,21.96,In stock (8 available)
Howl and Other Poems,Poetry,2,40.45,In stock (8 available)
History of Beauty,Art,4,10.29,In stock (8 available)
Heaven is for Real: A Little Boy's Astounding Story of His Trip to Heaven and Back,Default,2,52.86,In stock (8 available)
Future Shock (Future Shock #1),Young Adult,5,55.65,In stock (8 available)
Ender's Game (The Ender Quintet #1),Default,1,43.64,In stock (8 available)
Diary of a Citizen Scientist: Chasing Tiger Beetles and Other New Ways of Engaging the World,Science,1,28.41,In stock (8 available)
Death by Leisure: A Cautionary Tale,Default,4,37.51,In stock (8 available)
Brilliant Beacons: A History of the American Lighthouse,History,3,11.45,In stock (8 available)
Brazen: The Courage to Find the You That's Been Hiding,Nonfiction,2,19.22,In stock (8 available)
Between the World and Me,Nonfiction,4,56.91,In stock (8 available)
Being Mortal: Medicine and What Matters in the End,Nonfiction,4,55.06,In stock (8 available)
"A Murder Over a Girl: Justice, Gender, Junior High",Nonfiction,3,13.2,In stock (8 available)
32 Yolks,Food and Drink,2,53.63,In stock (8 available)
"""Most Blessed of the Patriarchs"": Thomas Jefferson and the Empire of the Imagination",History,5,44.48,In stock (8 available)
You Are a Badass: How to Stop Doubting Your Greatness and Start Living an Awesome Life,Self Help,3,12.08,In stock (7 available)
Wildlife of New York: A Five-Borough Coloring Book,Default,2,22.14,In stock (7 available)
What Happened on Beale Street (Secrets of the South Mysteries #2),Mystery,5,25.37,In stock (7 available)
Unreasonable Hope: Finding Faith in the God Who Brings Purpose to Your Pain,Spirituality,2,46.33,In stock (7 available)
Under the Tuscan Sun,Travel,3,37.33,In stock (7 available)
Toddlers Are A**holes: It's Not Your Fault,Humor,1,25.55,In stock (7 available)
The Year of Living Biblically: One Man's Humble Quest to Follow the Bible as Literally as Possible,Default,1,34.72,In stock (7 available)
The Whale,Childrens,4,35.96,In stock (7 available)
The Story of Art,Art,4,41.14,In stock (7 available)
The Origin of Species,Science,4,10.01,In stock (7 available)
The Great Gatsby,Default,4,36.05,In stock (7 available)
The Good Girl,Default,3,49.03,In stock (7 available)
The Glass Castle,Add a comment,1,16.24,In stock (7 available)
The Faith of Christopher Hitchens: The Restless Soul of the World's Most Notorious Atheist,Biography,1,39.55,In stock (7 available)
The Drowning Girls,Add a comment,3,35.67,In stock (7 available)
The Constant Princess (The Tudor Court #1),Historical Fiction,3,16.62,In stock (7 available)
The Bourne Identity (Jason Bourne #1),Fiction,4,42.78,In stock (7 available)
The Bachelor Girl's Guide to Murder (Herringford and Watts Mysteries #1),Mystery,5,52.3,In stock (7 available)
The Art Book,Art,2,32.34,In stock (7 available)
The 7 Habits of Highly Effective People: Powerful Lessons in Personal Change,Default,4,33.17,In stock (7 available)
Team of Rivals: The Political Genius of Abraham Lincoln,Add a comment,5,20.12,In stock (7 available)
Steal Like an Artist: 10 Things Nobody Told You About Being Creative,Default,2,20.9,In stock (7 available)
"Sit, Stay, Love",Romance,3,20.9,In stock (7 available)
Sister Dear,Fiction,4,40.2,In stock (7 available)
"Shrunken Treasures: Literary Classics, Short, Sweet, and Silly",Childrens,3,52.87,In stock (7 available)
"Rich Dad, Poor Dad",Business,1,51.74,In stock (7 available)
Raymie Nightingale,Childrens,2,34.41,In stock (7 available)
Playing from the Heart,Childrens,1,32.38,In stock (7 available)
Nightstruck: A Novel,Young Adult,4,50.35,In stock (7 available)
"Naturally Lean: 125 Nourishing Gluten-Free, Plant-Based Recipes--All Under 300 Calories",Food and Drink,5,11.38,In stock (7 available)
Meternity,Womens Fiction,3,43.58,In stock (7 available)
Memoirs of a Geisha,Fiction,3,49.67,In stock (7 available)
Like Never Before (Walker Family #2),Christian Fiction,2,28.77,In stock (7 available)
Life of Pi,Default,4,13.22,In stock (7 available)
Leave This Song Behind: Teen Poetry at Its Best,Poetry,5,51.17,In stock (7 available)
King's Folly (The Kinsman Chronicles #1),Fantasy,5,39.61,In stock (7 available)
John Adams,Add a comment,4,57.43,In stock (7 available)
How to Cook Everything Vegetarian: Simple Meatless Recipes for Great Food (How to Cook Everything),Food and Drink,4,46.01,In stock (7 available)
How to Be a Domestic Goddess: Baking and the Art of Comfort Cooking,Food and Drink,2,28.25,In stock (7 available)
Good in Bed (Cannie Shapiro #1),Add a comment,5,37.05,In stock (7 available)
"Fruits Basket, Vol. 7 (Fruits Basket #7)",Sequential Art,1,19.57,In stock (7 available)
For the Love: Fighting for Grace in a World of Impossible Standards,Nonfiction,3,45.13,In stock (7 available)
Finding God in the Ruins: How God Redeems Pain,Nonfiction,2,46.64,In stock (7 available)
Every Heart a Doorway (Every Heart A Doorway #1),Fantasy,5,12.16,In stock (7 available)
Delivering the Truth (Quaker Midwife Mystery #1),Mystery,4,20.89,In stock (7 available)
Counted With the Stars (Out from Egypt #1),Christian Fiction,5,17.97,In stock (7 available)
"Chronicles, Vol. 1",Music,2,52.6,In stock (7 available)
Blue Like Jazz: Nonreligious Thoughts on Christian Spirituality,Christian,1,25.77,In stock (7 available)
Benjamin Franklin: An American Life,Biography,3,48.19,In stock (7 available)
"At The Existentialist Café: Freedom, Being, and apricot cocktails with: Jean-Paul Sartre, Simone de Beauvoir, Albert Camus, Martin Heidegger, Edmund Husserl, Karl Jaspers, Maurice Merleau-Ponty and others",Philosophy,5,29.93,In stock (7 available)
A Summer In Europe,Travel,2,44.34,In stock (7 available)
A Short History of Nearly Everything,History,5,52.4,In stock (7 available)
A Gathering of Shadows (Shades of Magic #2),Fantasy,4,44.81,In stock (7 available)
The Sound Of Love,Default,5,57.84,In stock (6 available)
The Rise and Fall of the Third Reich: A History of Nazi Germany,History,2,39.67,In stock (6 available)
The Perks of Being a Wallflower,Default,3,55.02,In stock (6 available)
The Mysterious Affair at Styles (Hercule Poirot #1),Mystery,4,24.8,In stock (6 available)
The Man Who Mistook His Wife for a Hat and Other Clinical Tales,Nonfiction,4,59.45,In stock (6 available)
The Makings of a Fatherless Child,Default,2,31.58,In stock (6 available)
The Joy of Cooking,Add a comment,4,43.27,In stock (6 available)
The Invention of Wings,Historical Fiction,1,37.34,In stock (6 available)
The Hobbit (Middle-Earth Universe),Default,5,17.8,In stock (6 available)
The Great Railway Bazaar,Travel,1,30.54,In stock (6 available)
The Golden Compass (His Dark Materials #1),Add a comment,1,18.77,In stock (6 available)
The God Delusion,Add a comment,3,46.85,In stock (6 available)
The Girl You Left Behind (The Girl You Left Behind #1),Historical,1,15.79,In stock (6 available)
The Fellowship of the Ring (The Lord of the Rings #1),Default,2,10.27,In stock (6 available)
The Collected Poems of W.B. Yeats (The Collected Works of W.B. Yeats #1),Poetry,5,15.42,In stock (6 available)
The Barefoot Contessa Cookbook,Food and Drink,5,59.92,In stock (6 available)
Tell the Wolves I'm Home,Young Adult,2,50.96,In stock (6 available)
Ship Leaves Harbor: Essays on Travel by a Recovering Journeyman,Default,3,30.6,In stock (6 available)
Pride and Prejudice,Add a comment,4,19.27,In stock (6 available)
Musicophilia: Tales of Music and the Brain,Default,1,46.58,In stock (6 available)
Mere Christianity,Add a comment,3,48.51,In stock (6 available)
Me Before You (Me Before You #1),Fiction,1,19.02,In stock (6 available)
In the Woods (Dublin Murder Squad #1),Mystery,2,38.38,In stock (6 available)
In Cold Blood,Nonfiction,4,49.98,In stock (6 available)
How to Stop Worrying and Start Living,Self Help,5,46.49,In stock (6 available)
Give It Back,Thriller,2,18.32,In stock (6 available)
"Girl, Interrupted",Nonfiction,3,42.14,In stock (6 available)
Fun Home: A Family Tragicomic,Add a comment,4,56.59,In stock (6 available)
"Fruits Basket, Vol. 6 (Fruits Basket #6)",Sequential Art,4,20.96,In stock (6 available)
Deception Point,Fiction,4,40.32,In stock (6 available)
"Death Note, Vol. 6: Give-and-Take (Death Note #6)",Sequential Art,3,36.39,In stock (6 available)
Catherine the Great: Portrait of a Woman,History,4,58.55,In stock (6 available)
Better Homes and Gardens New Cook Book,Food and Drink,3,39.61,In stock (6 available)
An Unquiet Mind: A Memoir of Moods and Madness,Psychology,3,21.3,In stock (6 available)
A Year in Provence (Provence #1),Travel,4,56.88,In stock (6 available)
World Without End (The Pillars of the Earth #2),Historical Fiction,4,32.97,In stock (5 available)
"Will Grayson, Will Grayson (Will Grayson, Will Grayson)",Young Adult,4,47.31,In stock (5 available)
Why Save the Bankers?: And Other Essays on Our Economic and Political Crisis,Nonfiction,2,48.67,In stock (5 available)
Where She Went (If I Stay #2),Young Adult,4,41.73,In stock (5 available)
What If?: Serious Scientific Answers to Absurd Hypothetical Questions,Default,4,53.68,In stock (5 available)
Two Summers,Young Adult,1,14.64,In stock (5 available)
This Is Your Brain on Music: The Science of a Human Obsession,Music,1,38.4,In stock (5 available)
The Secret Garden,Classics,4,15.08,In stock (5 available)
The Raven King (The Raven Cycle #4),Add a comment,2,30.57,In stock (5 available)
The Raven Boys (The Raven Cycle #1),Fantasy,4,57.74,In stock (5 available)
The Power Greens Cookbook: 140 Delicious Superfood Recipes,Food and Drink,5,11.05,In stock (5 available)
The Metamorphosis,Classics,1,28.58,In stock (5 available)
The Mathews Men: Seven Brothers and the War Against Hitler's U-boats,History,5,42.91,In stock (5 available)
The Little Paris Bookshop,Fiction,3,24.73,In stock (5 available)
The Hiding Place,History,4,55.91,In stock (5 available)
The Grand Design,Science,3,13.76,In stock (5 available)
The Firm,Fiction,3,45.56,In stock (5 available)
The Fault in Our Stars,Default,1,47.22,In stock (5 available)
The False Prince (The Ascendance Trilogy #1),Fantasy,5,56.0,In stock (5 available)
The Expatriates,Fiction,2,44.58,In stock (5 available)
The Dream Thieves (The Raven Cycle #2),Default,1,34.5,In stock (5 available)
The Darkest Corners,Young Adult,5,11.33,In stock (5 available)
The Crossover,Poetry,4,38.77,In stock (5 available)
The 5th Wave (The 5th Wave #1),Default,2,11.83,In stock (5 available)
Tell the Wind and Fire,Fantasy,3,45.51,In stock (5 available)
Tell Me Three Things,Young Adult,1,41.81,In stock (5 available)
Talking to Girls About Duran Duran: One Young Man's Quest for True Love and a Cooler Haircut,Nonfiction,4,25.15,In stock (5 available)
Siddhartha,Fiction,5,34.22,In stock (5 available)
Shiver (The Wolves of Mercy Falls #1),Default,5,16.23,In stock (5 available)
Remember Me?,Default,3,11.48,In stock (5 available)
Red Dragon (Hannibal Lecter #1),Horror,3,23.37,In stock (5 available)
Peak: Secrets from the New Science of Expertise,Science,2,16.28,In stock (5 available)
My Mother Was Nuts,Nonfiction,4,31.63,In stock (5 available)
Mexican Today: New and Rediscovered Recipes for Contemporary Kitchens,Food and Drink,5,24.91,In stock (5 available)
Maybe Something Beautiful: How Art Transformed a Neighborhood,Childrens,1,22.54,In stock (5 available)
