Title,Category,Rating (1-5),Price (£),Availability
Lola and the Boy Next Door (Anna and the French Kiss #2),Young Adult,4,23.63,In stock (5 available)
Logan Kade (Fallen Crest High #5.5),Academic,2,13.12,In stock (5 available)
Last One Home (New Beginnings #1),Fiction,3,59.98,In stock (5 available)
Killing Floor (Jack Reacher #1),Thriller,4,31.49,In stock (5 available)
Kill the Boy Band,Young Adult,5,15.52,In stock (5 available)
Isla and the Happily Ever After (Anna and the French Kiss #3),Young Adult,5,48.13,In stock (5 available)
If I Stay (If I Stay #1),Default,5,38.13,In stock (5 available)
I Know Why the Caged Bird Sings (Maya Angelou's Autobiography #1),Default,2,36.55,In stock (5 available)
Harry Potter and the Deathly Hallows (Harry Potter #7),Default,1,23.32,In stock (5 available)
"Fruits Basket, Vol. 5 (Fruits Basket #5)",Sequential Art,1,16.33,In stock (5 available)
Foundation (Foundation (Publication Order) #1),Science Fiction,1,32.42,In stock (5 available)
Fool Me Once,Default,1,16.96,In stock (5 available)
Find Her (Detective D.D. Warren #8),Add a comment,1,22.37,In stock (5 available)
Evicted: Poverty and Profit in the American City,Add a comment,1,42.27,In stock (5 available)
Drama,Default,2,38.7,In stock (5 available)
Dracula the Un-Dead,Horror,5,35.63,In stock (5 available)
Digital Fortress,Fiction,5,58.0,In stock (5 available)
"Death Note, Vol. 5: Whiteout (Death Note #5)",Sequential Art,1,52.41,In stock (5 available)
"Data, A Love Story: How I Gamed Online Dating to Meet My Match",Nonfiction,3,32.35,In stock (5 available)
Critique of Pure Reason,Philosophy,1,20.75,In stock (5 available)
Booked,Poetry,5,17.49,In stock (5 available)
"Blue Lily, Lily Blue (The Raven Cycle #3)",Default,5,34.13,In stock (5 available)
Approval Junkie: Adventures in Caring Too Much,Autobiography,5,58.81,In stock (5 available)
An Abundance of Katherines,Young Adult,5,10.0,In stock (5 available)
America's War for the Greater Middle East: A Military History,History,2,51.22,In stock (5 available)
Alight (The Generations Trilogy #2),Default,4,58.59,In stock (5 available)
A Girl's Guide to Moving On (New Beginnings #2),Romance,1,31.3,In stock (5 available)
A Game of Thrones (A Song of Ice and Fire #1),Add a comment,2,46.42,In stock (5 available)
A Feast for Crows (A Song of Ice and Fire #4),Fantasy,4,17.21,In stock (5 available)
A Clash of Kings (A Song of Ice and Fire #2),Add a comment,3,10.79,In stock (5 available)
Vogue Colors A to Z: A Fashion Coloring Book,Default,4,52.35,In stock (4 available)
The Shining (The Shining #1),Default,3,27.88,In stock (4 available)
The Pilgrim's Progress,Classics,2,50.26,In stock (4 available)
The Perfect Play (Play by Play #1),Romance,3,59.99,In stock (4 available)
The Passion of Dolssa,Historical Fiction,5,28.32,In stock (4 available)
The Jazz of Physics: The Secret Link Between Music and the Structure of the Universe,Nonfiction,3,38.71,In stock (4 available)
The Hunger Games (The Hunger Games #1),Default,5,29.85,In stock (4 available)
The Hound of the Baskervilles (Sherlock Holmes #5),Classics,2,14.82,In stock (4 available)
The Gunning of America: Business and the Making of American Gun Culture,Nonfiction,4,16.81,In stock (4 available)
The Geography of Bliss: One Grump's Search for the Happiest Places in the World,Nonfiction,2,28.23,In stock (4 available)
The Demonists (Demonist #1),Fantasy,2,52.11,In stock (4 available)
"The Demon Prince of Momochi House, Vol. 4 (The Demon Prince of Momochi House #4)",Sequential Art,2,27.88,In stock (4 available)
The Bone Hunters (Lexy Vaughan & Steven Macaulay #2),Thriller,3,59.71,In stock (4 available)
The Beast (Black Dagger Brotherhood #14),Fantasy,5,46.08,In stock (4 available)
Some Women,Womens Fiction,5,13.73,In stock (4 available)
Shopaholic Ties the Knot (Shopaholic #3),Womens Fiction,5,48.39,In stock (4 available)
Paper and Fire (The Great Library #2),Fantasy,5,49.45,In stock (4 available)
Outlander (Outlander #1),Default,5,19.67,In stock (4 available)
"Orchestra of Exiles: The Story of Bronislaw Huberman, the Israel Philharmonic, and the One Thousand Jews He Saved from Nazi Horrors",Music,3,12.36,In stock (4 available)
No One Here Gets Out Alive,Music,5,20.02,In stock (4 available)
Night Shift (Night Shift #1-20),Horror,4,12.75,In stock (4 available)
Needful Things,Horror,4,47.51,In stock (4 available)
Mockingjay (The Hunger Games #3),Default,4,20.44,In stock (4 available)
Misery,Horror,2,34.79,In stock (4 available)
Little Women (Little Women #1),Classics,4,28.07,In stock (4 available)
It,Horror,3,25.01,In stock (4 available)
Harry Potter and the Sorcerer's Stone (Harry Potter #1),Default,3,13.9,In stock (4 available)
Harry Potter and the Prisoner of Azkaban (Harry Potter #3),Young Adult,4,24.17,In stock (4 available)
Harry Potter and the Order of the Phoenix (Harry Potter #5),Fantasy,4,31.63,In stock (4 available)
Harry Potter and the Half-Blood Prince (Harry Potter #6),Fantasy,5,48.75,In stock (4 available)
Harry Potter and the Chamber of Secrets (Harry Potter #2),Fantasy,1,14.74,In stock (4 available)
Gone with the Wind,Classics,3,32.49,In stock (4 available)
God Is Not Great: How Religion Poisons Everything,Nonfiction,1,27.8,In stock (4 available)
Girl With a Pearl Earring,Historical Fiction,1,26.77,In stock (4 available)
"Fruits Basket, Vol. 4 (Fruits Basket #4)",Sequential Art,4,50.44,In stock (4 available)
Far From True (Promise Falls Trilogy #2),Thriller,2,34.93,In stock (4 available)
Dark Lover (Black Dagger Brotherhood #1),Romance,1,12.87,In stock (4 available)
Confessions of a Shopaholic (Shopaholic #1),Default,2,48.94,In stock (4 available)
Changing the Game (Play by Play #2),Romance,3,13.38,In stock (4 available)
Candide,Classics,3,58.63,In stock (4 available)
Can You Keep a Secret?,Womens Fiction,1,21.94,In stock (4 available)
Atlas Shrugged,Fiction,5,26.58,In stock (4 available)
Animal Farm,Classics,3,57.22,In stock (4 available)
A Walk to Remember,Romance,1,56.43,In stock (4 available)
A New Earth: Awakening to Your Life's Purpose,Spirituality,5,55.65,In stock (4 available)
"A History of God: The 4,000-Year Quest of Judaism, Christianity, and Islam",Religion,1,27.62,In stock (4 available)
'Salem's Lot,Horror,4,49.56,In stock (4 available)
Zero History (Blue Ant #3),Default,1,34.77,In stock (3 available)
Wuthering Heights,Classics,3,17.73,In stock (3 available)
World War Z: An Oral History of the Zombie War,Default,1,21.8,In stock (3 available)
Wild: From Lost to Found on the Pacific Crest Trail,Default,3,46.02,In stock (3 available)
"Where'd You Go, Bernadette",Default,1,18.13,In stock (3 available)
When You Are Engulfed in Flames,Humor,5,30.89,In stock (3 available)
We the People: The Modern-Day Figures Who Have Reshaped and Affirmed the Founding Fathers' Vision of America,Nonfiction,3,31.95,In stock (3 available)
We Are All Completely Beside Ourselves,Contemporary,1,24.04,In stock (3 available)
Walk the Edge (Thunder Road #2),Young Adult,3,32.36,In stock (3 available)
Voyager (Outlander #3),Historical Fiction,5,21.07,In stock (3 available)
Very Good Lives: The Fringe Benefits of Failure and the Importance of Imagination,Nonfiction,3,50.66,In stock (3 available)
Vegan Vegetarian Omnivore: Dinner for Everyone at the Table,Food and Drink,2,13.66,In stock (3 available)
"Unstuffed: Decluttering Your Home, Mind, and Soul",Nonfiction,1,58.09,In stock (3 available)
Under the Banner of Heaven: A Story of Violent Faith,Nonfiction,1,30.0,In stock (3 available)
Two Boys Kissing,Young Adult,2,32.74,In stock (3 available)
Twilight (Twilight #1),Default,2,41.93,In stock (3 available)
Twenties Girl,Womens Fiction,2,42.8,In stock (3 available)
"Trespassing Across America: One Man's Epic, Never-Done-Before (and Sort of Illegal) Hike Across the Heartland",Nonfiction,1,53.51,In stock (3 available)
Three-Martini Lunch,Fiction,3,23.21,In stock (3 available)
"Thinking, Fast and Slow",Psychology,1,21.14,In stock (3 available)
The Wild Robot,Childrens,3,56.07,In stock (3 available)
"The Wicked + The Divine, Vol. 3: Commercial Suicide (The Wicked + The Divine)",Sequential Art,3,14.41,In stock (3 available)
The Undomestic Goddess,Womens Fiction,4,45.75,In stock (3 available)
The Travelers,Thriller,1,15.77,In stock (3 available)
The Tipping Point: How Little Things Can Make a Big Difference,Add a comment,2,10.02,In stock (3 available)
The Thing About Jellyfish,Childrens,1,48.77,In stock (3 available)
The Stand,Horror,2,57.86,In stock (3 available)
The Smitten Kitchen Cookbook,Food and Drink,1,23.59,In stock (3 available)
The Silkworm (Cormoran Strike #2),Mystery,5,23.05,In stock (3 available)
"The Sandman, Vol. 3: Dream Country (The Sandman (volumes) #3)",Sequential Art,5,55.55,In stock (3 available)
The Rose & the Dagger (The Wrath and the Dawn #2),Fantasy,4,58.64,In stock (3 available)
The Road to Little Dribbling: Adventures of an American in Britain (Notes From a Small Island #2),Travel,1,23.21,In stock (3 available)
The Rise of Theodore Roosevelt (Theodore Roosevelt #1),Biography,3,42.57,In stock (3 available)
The Restaurant at the End of the Universe (Hitchhiker's Guide to the Galaxy #2),Science Fiction,1,10.92,In stock (3 available)
The Rest Is Noise: Listening to the Twentieth Century,Add a comment,1,34.77,In stock (3 available)
The Red Tent,Historical Fiction,5,35.66,In stock (3 available)
The Purpose Driven Life: What on Earth Am I Here for?,Add a comment,3,37.19,In stock (3 available)
The Purest Hook (Second Circle Tattoos #3),Romance,1,12.25,In stock (3 available)
The Picture of Dorian Gray,Classics,2,29.7,In stock (3 available)
The Paris Wife,Default,3,36.8,In stock (3 available)
The Obsession,Romance,1,45.43,In stock (3 available)
The Nightingale,Fiction,4,26.26,In stock (3 available)
The New Guy (and Other Senior Year Distractions),Young Adult,3,44.92,In stock (3 available)
The Nanny Diaries (Nanny #1),Womens Fiction,5,52.53,In stock (3 available)
The Name of God is Mercy,Nonfiction,2,37.25,In stock (3 available)
The Maze Runner (The Maze Runner #1),Default,1,20.93,In stock (3 available)
The Lover's Dictionary,Default,2,58.09,In stock (3 available)
The Lonely Ones,Childrens,5,43.59,In stock (3 available)
The Lean Startup: How Today's Entrepreneurs Use Continuous Innovation to Create Radically Successful Businesses,Business,3,33.92,In stock (3 available)
The Last Painting of Sara de Vos,Historical Fiction,2,55.55,In stock (3 available)
"The Land of 10,000 Madonnas",Young Adult,4,29.64,In stock (3 available)
The Infinities,Fiction,1,27.41,In stock (3 available)
The Husband's Secret,Fiction,5,52.51,In stock (3 available)
The Hitchhiker's Guide to the Galaxy (Hitchhiker's Guide to the Galaxy #1),Add a comment,3,47.8,In stock (3 available)
The Guns of August,History,2,14.54,In stock (3 available)
The Guernsey Literary and Potato Peel Pie Society,Historical Fiction,1,49.53,In stock (3 available)
The Goldfinch,Default,3,43.58,In stock (3 available)
The Giver (The Giver Quartet #1),Default,1,12.3,In stock (3 available)
The Girl with All the Gifts,Horror,3,49.47,In stock (3 available)
The Girl Who Played with Fire (Millennium Trilogy #2),Default,2,22.14,In stock (3 available)
The Girl Who Kicked the Hornet's Nest (Millennium Trilogy #3),Add a comment,1,57.48,In stock (3 available)
The Exiled,Mystery,3,43.45,In stock (3 available)
"The End of Faith: Religion, Terror, and the Future of Reason",Add a comment,4,22.13,In stock (3 available)
"The Elegant Universe: Superstrings, Hidden Dimensions, and the Quest for the Ultimate Theory",Science,4,13.03,In stock (3 available)
"The Disappearing Spoon: And Other True Tales of Madness, Love, and the History of the World from the Periodic Table of the Elements",Science,5,57.35,In stock (3 available)
The Devil Wears Prada (The Devil Wears Prada #1),Womens Fiction,1,44.29,In stock (3 available)
The Demon-Haunted World: Science as a Candle in the Dark,Default,4,52.25,In stock (3 available)
The Day the Crayons Came Home (Crayons),Childrens,5,26.33,In stock (3 available)
The Da Vinci Code (Robert Langdon #2),Fiction,2,22.96,In stock (3 available)
The Cuckoo's Calling (Cormoran Strike #1),Mystery,1,19.21,In stock (3 available)
The Complete Stories and Poems (The Works of Edgar Allan Poe [Cameo Edition]),Classics,4,26.78,In stock (3 available)
The Complete Poems,Add a comment,5,41.32,In stock (3 available)
The Catcher in the Rye,Add a comment,1,24.55,In stock (3 available)
The Cat in the Hat (Beginner Books B-1),Childrens,2,16.26,In stock (3 available)
The Case for Christ (Cases for Christianity),Add a comment,1,47.84,In stock (3 available)
The Book Thief,Default,2,53.49,In stock (3 available)
The Book of Basketball: The NBA According to The Sports Guy,Sports and Games,5,44.84,In stock (3 available)
The Blind Side: Evolution of a Game,Add a comment,5,53.71,In stock (3 available)
The Autobiography of Malcolm X,Default,2,23.43,In stock (3 available)
"The Art of Simple Food: Notes, Lessons, and Recipes from a Delicious Revolution",Food and Drink,3,34.32,In stock (3 available)
The Art of Fielding,Fiction,1,22.1,In stock (3 available)
"Surely You're Joking, Mr. Feynman!: Adventures of a Curious Character",Science,2,25.83,In stock (3 available)
Stiff: The Curious Lives of Human Cadavers,Nonfiction,3,36.74,In stock (3 available)
Spilled Milk: Based on a True Story,Nonfiction,1,49.51,In stock (3 available)
Something Borrowed (Darcy & Rachel #1),Womens Fiction,5,48.96,In stock (3 available)
Something Blue (Darcy & Rachel #2),Womens Fiction,1,54.62,In stock (3 available)
Soldier (Talon #3),Fantasy,2,24.72,In stock (3 available)
Shopaholic & Baby (Shopaholic #5),Default,2,46.45,In stock (3 available)
Seven Days in the Art World,Add a comment,2,52.33,In stock (3 available)
Seven Brief Lessons on Physics,Science,4,30.6,In stock (3 available)
Scarlet (The Lunar Chronicles #2),Young Adult,4,14.57,In stock (3 available)
Sarah's Key,Add a comment,1,46.29,In stock (3 available)
"Saga, Volume 3 (Saga (Collected Editions) #3)",Sequential Art,5,21.57,In stock (3 available)
Running with Scissors,Autobiography,4,12.91,In stock (3 available)
Rogue Lawyer (Rogue Lawyer #1),Add a comment,3,50.11,In stock (3 available)
"Rise of the Rocket Girls: The Women Who Propelled Us, from Missiles to the Moon to Mars",Nonfiction,4,41.67,In stock (3 available)
Rework,Business,2,44.88,In stock (3 available)
Reservations for Two,Romance,3,11.1,In stock (3 available)
Red: The True Story of Red Riding Hood,Childrens,3,28.54,In stock (3 available)
Ready Player One,Science Fiction,4,19.07,In stock (3 available)
Quiet: The Power of Introverts in a World That Can't Stop Talking,Default,1,43.55,In stock (3 available)
Prodigy: The Graphic Novel (Legend: The Graphic Novel #2),Sequential Art,3,43.63,In stock (3 available)
Persepolis: The Story of a Childhood (Persepolis #1-2),Sequential Art,1,39.13,In stock (3 available)
Packing for Mars: The Curious Science of Life in the Void,Default,2,56.68,In stock (3 available)
Outliers: The Story of Success,Nonfiction,1,14.16,In stock (3 available)
Original Fake,Sequential Art,3,31.45,In stock (3 available)
Orange Is the New Black,Default,2,24.61,In stock (3 available)
One for the Money (Stephanie Plum #1),Default,2,32.87,In stock (3 available)
Notes from a Small Island (Notes From a Small Island #1),Nonfiction,1,40.17,In stock (3 available)
Night (The Night Trilogy #1),Nonfiction,1,13.51,In stock (3 available)
Neither Here nor There: Travels in Europe,Travel,3,38.95,In stock (3 available)
Naked,Humor,3,31.69,In stock (3 available)
Morning Star (Red Rising #3),Default,1,29.4,In stock (3 available)
"Miracles from Heaven: A Little Girl, Her Journey to Heaven, and Her Amazing Story of Healing",Nonfiction,1,57.83,In stock (3 available)
Midnight Riot (Peter Grant/ Rivers of London - books #1),Fantasy,2,55.46,In stock (3 available)
Me Talk Pretty One Day,Autobiography,2,57.6,In stock (3 available)
Manuscript Found in Accra,Add a comment,2,34.98,In stock (3 available)
Lust & Wonder,Autobiography,2,11.87,In stock (3 available)
Lila (Gilead #3),Fiction,3,12.47,In stock (3 available)
"Life, the Universe and Everything (Hitchhiker's Guide to the Galaxy #3)",Science Fiction,2,33.26,In stock (3 available)
Life Without a Recipe,Autobiography,5,59.04,In stock (3 available)
Life After Life,Default,2,26.13,In stock (3 available)
Letter to a Christian Nation,Nonfiction,1,22.2,In stock (3 available)
Let's Pretend This Never Happened: A Mostly True Memoir,Nonfiction,1,45.11,In stock (3 available)
Legend (Legend #1),Young Adult,4,43.69,In stock (3 available)
"Lean In: Women, Work, and the Will to Lead",Default,1,25.02,In stock (3 available)
"Lamb: The Gospel According to Biff, Christ's Childhood Pal",Humor,5,55.5,In stock (3 available)
Lady Renegades (Rebel Belle #3),Young Adult,5,53.04,In stock (3 available)
Jurassic Park (Jurassic Park #1),Fiction,1,44.97,In stock (3 available)
It's Never Too Late to Begin Again: Discovering Creativity and Meaning at Midlife and Beyond,Nonfiction,1,42.38,In stock (3 available)
Is Everyone Hanging Out Without Me? (And Other Concerns),Default,3,20.11,In stock (3 available)
Into the Wild,Nonfiction,5,56.7,In stock (3 available)
Inferno (Robert Langdon #4),Fiction,5,41.0,In stock (3 available)
"In the Garden of Beasts: Love, Terror, and an American Family in Hitler's Berlin",Nonfiction,3,28.85,In stock (3 available)
If I Run (If I Run #1),Christian Fiction,4,49.97,In stock (3 available)
I've Got Your Number,Womens Fiction,1,19.69,In stock (3 available)
I Am Malala: The Girl Who Stood Up for Education and Was Shot by the Taliban,Nonfiction,2,28.88,In stock (3 available)
Hungry Girl Clean & Hungry: Easy All-Natural Recipes for Healthy Eating in the Real World,Food and Drink,3,33.14,In stock (3 available)
"House of Lost Worlds: Dinosaurs, Dynasties, and the Story of Life on Earth",History,2,43.7,In stock (3 available)
House of Leaves,Horror,1,54.89,In stock (3 available)
Horrible Bear!,Childrens,2,37.52,In stock (3 available)
Holidays on Ice,Humor,2,51.07,In stock (3 available)
Heir to the Sky,Fantasy,4,44.07,In stock (3 available)
Green Eggs and Ham (Beginner Books B-16),Childrens,4,10.79,In stock (3 available)
"Grayson, Vol 3: Nemesis (Grayson #3)",Sequential Art,1,42.72,In stock (3 available)
Gratitude,Nonfiction,5,26.66,In stock (3 available)
Gone Girl,Default,5,37.6,In stock (3 available)
Golden (Heart of Dread #3),Young Adult,4,42.21,In stock (3 available)
Girl in the Blue Coat,Historical Fiction,2,46.83,In stock (3 available)
"Fruits Basket, Vol. 3 (Fruits Basket #3)",Sequential Art,2,45.17,In stock (3 available)
"Friday Night Lights: A Town, a Team, and a Dream",Sports and Games,3,51.22,In stock (3 available)
Fire Bound (Sea Haven/Sisters of the Heart #5),Add a comment,4,21.28,In stock (3 available)
Fifty Shades Freed (Fifty Shades #3),Adult Fiction,5,15.36,In stock (3 available)
Fellside,Default,1,38.62,In stock (3 available)
Extreme Prey (Lucas Davenport #26),Mystery,3,25.4,In stock (3 available)
Eragon (The Inheritance Cycle #1),Fantasy,3,43.87,In stock (3 available)
Eclipse (Twilight #3),Default,1,18.74,In stock (3 available)
Dune (Dune #1),Science Fiction,1,54.86,In stock (3 available)
Dracula,Default,3,52.62,In stock (3 available)
Do Androids Dream of Electric Sheep? (Blade Runner #1),Science Fiction,1,51.48,In stock (3 available)
Disrupted: My Misadventure in the Start-Up Bubble,Nonfiction,5,15.28,In stock (3 available)
Dead Wake: The Last Crossing of the Lusitania,Default,5,39.24,In stock (3 available)
"David and Goliath: Underdogs, Misfits, and the Art of Battling Giants",Default,1,17.81,In stock (3 available)
Darkfever (Fever #1),Fantasy,1,56.02,In stock (3 available)
Dark Places,Default,5,23.9,In stock (3 available)
Crazy Rich Asians (Crazy Rich Asians #1),Fiction,5,49.13,In stock (3 available)
Counting Thyme,Childrens,1,10.62,In stock (3 available)
Cosmos,Add a comment,2,36.17,In stock (3 available)
Civilization and Its Discontents,Psychology,2,59.95,In stock (3 available)
Cinder (The Lunar Chronicles #1),Young Adult,1,26.09,In stock (3 available)
Catastrophic Happiness: Finding Joy in Childhood's Messy Years,Parenting,2,37.35,In stock (3 available)
Career of Evil (Cormoran Strike #3),Mystery,2,24.72,In stock (3 available)
Breaking Dawn (Twilight #4),Default,5,35.28,In stock (3 available)
Brave Enough,Nonfiction,5,51.32,In stock (3 available)
Boy Meets Boy,Young Adult,3,21.12,In stock (3 available)
"Born to Run: A Hidden Tribe, Superathletes, and the Greatest Race the World Has Never Seen",Nonfiction,2,27.35,In stock (3 available)
Blink: The Power of Thinking Without Thinking,Nonfiction,5,21.74,In stock (3 available)
Black Flags: The Rise of ISIS,Nonfiction,1,40.87,In stock (3 available)
"Black Butler, Vol. 1 (Black Butler #1)",Sequential Art,1,49.31,In stock (3 available)
Big Little Lies,Fiction,1,22.11,In stock (3 available)
Between Shades of Gray,Historical Fiction,5,20.79,In stock (3 available)
Best of My Love (Fool's Gold #20),Romance,2,27.41,In stock (3 available)
Beowulf,Classics,2,38.35,In stock (3 available)
Beautiful Creatures (Caster Chronicles #1),Default,5,21.55,In stock (3 available)
Awkward,Sequential Art,2,38.02,In stock (3 available)
Ash,Fantasy,4,22.06,In stock (3 available)
Are We There Yet?,Childrens,3,10.66,In stock (3 available)
Are We Smart Enough to Know How Smart Animals Are?,Nonfiction,1,56.58,In stock (3 available)
Annie on My Mind,Young Adult,5,36.83,In stock (3 available)
And Then There Were None,Classics,2,35.01,In stock (3 available)
A Walk in the Woods: Rediscovering America on the Appalachian Trail,Nonfiction,4,30.48,In stock (3 available)
A Visit from the Goon Squad,Default,5,14.08,In stock (3 available)
A Storm of Swords (A Song of Ice and Fire #3),Fantasy,2,31.22,In stock (3 available)
A Heartbreaking Work of Staggering Genius,Autobiography,5,54.29,In stock (3 available)
8 Keys to Mental Health Through Exercise,Psychology,1,31.04,In stock (3 available)
#GIRLBOSS,Add a comment,1,50.96,In stock (3 available)
"The Suffragettes (Little Black Classics, #96)",Nonfiction,2,11.89,In stock (2 available)
The Sense of an Ending,Add a comment,3,31.38,In stock (2 available)
"The Sandman, Vol. 2: The Doll's House (The Sandman (volumes) #2)",Sequential Art,1,54.81,In stock (2 available)
The Course of Love,Fiction,3,16.78,In stock (2 available)
Sugar Rush (Offensive Line #2),Sports and Games,1,24.42,In stock (2 available)
"Saga, Volume 2 (Saga (Collected Editions) #2)",Sequential Art,3,11.75,In stock (2 available)
"Run, Spot, Run: The Ethics of Keeping Pets",Philosophy,1,20.02,In stock (2 available)
New Moon (Twilight #2),Young Adult,4,12.86,In stock (2 available)
Life,Music,5,31.58,In stock (2 available)
Kindle Paperwhite User's Guide,Nonfiction,3,34.0,In stock (2 available)
H is for Hawk,Nonfiction,5,57.42,In stock (2 available)
Girl Online On Tour (Girl Online #2),Young Adult,1,53.47,In stock (2 available)
"Fruits Basket, Vol. 2 (Fruits Basket #2)",Sequential Art,5,11.64,In stock (2 available)
Diary of a Minecraft Zombie Book 1: A Scare of a Dare (An Unofficial Minecraft Book),Childrens,4,52.88,In stock (2 available)
"Y: The Last Man, Vol. 1: Unmanned (Y: The Last Man #1)",Sequential Art,4,18.51,In stock (1 available)
While You Were Mine,Historical Fiction,5,41.32,In stock (1 available)
Where Lightning Strikes (Bleeding Stars #3),Romance,3,39.77,In stock (1 available)
When I'm Gone,Fiction,3,51.96,In stock (1 available)
Ways of Seeing,Art,5,39.51,In stock (1 available)
"Vampire Knight, Vol. 1 (Vampire Knight #1)",Paranormal,1,15.4,In stock (1 available)
Vampire Girl (Vampire Girl #1),Fantasy,2,53.82,In stock (1 available)
Twenty Love Poems and a Song of Despair,Poetry,4,30.95,In stock (1 available)
Travels with Charley: In Search of America,Nonfiction,5,57.82,In stock (1 available)
Three Wishes (River of Time: California #1),Science Fiction,2,44.18,In stock (1 available)
This One Moment (Pushing Limits #1),Romance,1,48.71,In stock (1 available)
The Zombie Room,Default,5,19.69,In stock (1 available)
"The Wicked + The Divine, Vol. 1: The Faust Act (The Wicked + The Divine)",Sequential Art,2,36.52,In stock (1 available)
The Tumor,Nonfiction,5,41.56,In stock (1 available)
The Story of Hong Gildong,Classics,4,43.19,In stock (1 available)
The Silent Wife,Fiction,5,12.34,In stock (1 available)
The Silent Twin (Detective Jennifer Knight #3),Fantasy,3,36.25,In stock (1 available)
The Selfish Gene,Science,1,29.45,In stock (1 available)
The Secret Healer,Historical Fiction,3,34.56,In stock (1 available)
"The Sandman, Vol. 1: Preludes and Nocturnes (The Sandman (volumes) #1)",Sequential Art,3,54.12,In stock (1 available)
The Republic,Add a comment,3,33.78,In stock (1 available)
The Odyssey,Add a comment,3,29.64,In stock (1 available)
The No. 1 Ladies' Detective Agency (No. 1 Ladies' Detective Agency #1),Mystery,4,57.7,In stock (1 available)
The Nicomachean Ethics,Philosophy,1,36.34,In stock (1 available)
The Name of the Wind (The Kingkiller Chronicle #1),Default,3,50.59,In stock (1 available)
The Mirror & the Maze (The Wrath and the Dawn #1.5),Fantasy,1,29.38,In stock (1 available)
The Little Prince,Classics,2,45.42,In stock (1 available)
The Light of the Fireflies,Add a comment,1,54.43,In stock (1 available)
The Last Girl (The Dominion Trilogy #1),Science Fiction,2,36.26,In stock (1 available)
The Iliad,Add a comment,1,16.16,In stock (1 available)
The Hook Up (Game On #1),New Adult,5,36.29,In stock (1 available)
The Haters,Young Adult,5,27.89,In stock (1 available)
The Girl You Lost,Mystery,5,12.29,In stock (1 available)
The Girl In The Ice (DCI Erika Foster #1),Mystery,3,15.85,In stock (1 available)
The End of the Jesus Era (An Investigation #1),Nonfiction,1,14.4,In stock (1 available)
The Edge of Reason (Bridget Jones #2),Womens Fiction,4,19.18,In stock (1 available)
The Complete Maus (Maus #1-2),Sequential Art,3,10.64,In stock (1 available)
The Communist Manifesto,Add a comment,3,14.76,In stock (1 available)
